To ongoing analysis customer data generation,To build maintain reports dashboards data,,To make work closely technology product,To model projects across business marketing,,,,,,,,,,,,,
To understand business requirements different teams,To learn role reporting business analysis,,To learn models datadriven tools support,To improve solution development process core,,,,,,,,,,,,,
To identify patterns trends data sets,To work experience technical data analysis,,To improve business outcomes responsibilities data,To learn techniques algorithms responsibilities aid,,,,,,,,,,,,,
To report components multiple data sources,To exist bi tools business areas,,To learn infrastructure engineering teams data,To improve companys engineering tools systems,,,,,,,,,,,,,
To develop solutions data analysis mainly,To report partnership product engineering design,,To learn work closely software engineering,To train tasks analysis optimization customer,,,,,,,,,,,,,
To base data analysis core job,To need backup support data operations,,,To build deploy models data products,,,,,,,,,,,,,
To identify trends insights appropriate client,To include sales data customer data,,,To develop production grade machine learning,,,,,,,,,,,,,
To report issues risk change management,To identify opportunities improvement work collaboratively,,,To develop machine learning models better,,,,,,,,,,,,,
To develop introduction support creation reports,To report solutions data analysis role,,,To collaborate product management engineering departments,,,,,,,,,,,,,
To identify trends opportunities growth analysis,To understand business processes order research,,,To identify trends measure performance use,,,,,,,,,,,,,
To ensure data integrity analyze business,To provide data analysis standard reporting,,,To collaborate product management understand needs,,,,,,,,,,,,,
To improve models performance business perspective,To provide insights monthly business processes,,,To learn techniques interpret client data,,,,,,,,,,,,,
To test web analytics data implementation,To report performance monitoring multiple data,,,To learn techniques youll leverage data,,,,,,,,,,,,,
To report analytics operational improvement participate,To report detection opportunities improvement web,,,To automate processes model development model,,,,,,,,,,,,,
To use reporting data analysis workflows,To make business insight communication marketing,,,To model data analysis address business,,,,,,,,,,,,,
To create customer engagement reporting modelling,To plan manage implementation new data,,,To develop range machine learning models,,,,,,,,,,,,,
To participate data management process implementation,To understand customers business development innovative,,,To improve efficiency applications role responsibilities,,,,,,,,,,,,,
To use data analysis youll help,To report data visualisation documentknowledge management,,,To collaborate product management quality assurance,,,,,,,,,,,,,
To make database data warehouse reporting,To identify data discrepancies quality issues,,,To ensure data products understood business,,,,,,,,,,,,,
To base analysis present management work,To include bi design forum data,,,To learn models nice responsibilities data,,,,,,,,,,,,,
To learn models data analysis keep,To provide support various reporting processes,,,To base data responsibilities design experiments,,,,,,,,,,,,,
To base data insights market perspectives,,,,To ensure delivery quality solutions support,,,,,,,,,,,,,
To assign job description research company,,,,To provide analytics teams job description,,,,,,,,,,,,,
To report team development launch clients,,,,To learn frameworks data analytics field,,,,,,,,,,,,,
To report clients management allow monitoring,,,,To learn models data analysis keep,,,,,,,,,,,,,
To identify improvement opportunities actionable insights,,,,To learn side projects personal development,,,,,,,,,,,,,
To improve performance efficiency work management,,,,To model techniques machine learning algorithms,,,,,,,,,,,,,
To use business analytics reporting tools,,,,To learn systems data platform processes,,,,,,,,,,,,,
To understand business process data flow,,,,To develop custom software solutions tools,,,,,,,,,,,,,
To develop dashboards visualization customer projects,,,,To learn models algorithms main responsibilities,,,,,,,,,,,,,
To identify escalate data quality issues,,,,To build support algorithms data transformation,,,,,,,,,,,,,
To work data prototype solutions analytics,,,,To learn techniques data mining processing,,,,,,,,,,,,,
To develop data driven insights analytics,,,,To build test creative solutions problems,,,,,,,,,,,,,
To use analysis creation documentation implementation,,,,To identify opportunities improvement work stakeholders,,,,,,,,,,,,,
To participate support development implementation division,,,,To learn systems nextgeneration cai products,,,,,,,,,,,,,
To improve customer experience define analytics,,,,To participate process improvement company products,,,,,,,,,,,,,
To identify areas improvement create dashboards,,,,To model multivariate statistics machine learning,,,,,,,,,,,,,
To report analysis business support budget,,,,To exist clients new business opportunities,,,,,,,,,,,,,
To report support advice business pricing,,,,To learn team understand performance machine,,,,,,,,,,,,,
To report evaluation provision analysis metrics,,,,To provide business insights work smes,,,,,,,,,,,,,
To report team data consumption differentinitiatives,,,,To learn technologies order solve business,,,,,,,,,,,,,
To develop maintain knowledge available reporting,,,,To improve customer experience scale algorithms,,,,,,,,,,,,,
To make coach analytics insights team,,,,To base business requirements data present,,,,,,,,,,,,,
To report model decision making processes,,,,To require design simulation test methods,,,,,,,,,,,,,
To improve business process generate insights,,,,To use experience software development design,,,,,,,,,,,,,
To provide insights business review models,,,,To learn models methods respond business,,,,,,,,,,,,,
To use customer data direct marketing,,,,To learn solutions research design machine,,,,,,,,,,,,,
To identify trends opportunities present strategies,,,,To develop test improve data processes,,,,,,,,,,,,,
To develop data quality check reports,,,,To provide analytics teams responsibilities part,,,,,,,,,,,,,
To report aspects business sides market,,,,To participate development machine learning modules,,,,,,,,,,,,,
To provide scheme insights support development,,,,To train research methodology data analytics,,,,,,,,,,,,,
To require analysis generate reports clients,,,,To improve methods tools machine learning,,,,,,,,,,,,,
To provide reports visualisations support business,,,,To learn techniques conjunction acr technology,,,,,,,,,,,,,
To require expectations role create maintain,,,,To work experience job description detect,,,,,,,,,,,,,
To report database environment reports training,,,,To learn techniques design implement scalable,,,,,,,,,,,,,
To identify trends opportunities within data,,,,To learn data analysis code python,,,,,,,,,,,,,
To provide backup support reporting data,,,,To exist solutions input solution design,,,,,,,,,,,,,
To make support development site analytics,,,,To train work technology team design,,,,,,,,,,,,,
To ensure data quality issues sufficiently,,,,To learn model data collection implementation,,,,,,,,,,,,,
To develop reporting strategies games development,,,,To model responsibilities enhance machine learning,,,,,,,,,,,,,
To report data analysis summary role,,,,To develop manage data analytics solutions,,,,,,,,,,,,,
To report decision making discover data,,,,To model job design build data,,,,,,,,,,,,,
To develop data analytics automation solutions,,,,To learn data mining data analysis,,,,,,,,,,,,,
To provide support business data needs,,,,To apply data mining machine learning,,,,,,,,,,,,,
To report visualisation data manage data,,,,To learn solutions public private clients,,,,,,,,,,,,,
To identify market trends product vulnerabilities,,,,To use data guide business solutions,,,,,,,,,,,,,
To provide reports tableau dashboards help,,,,To learn workflows systems data ingestion,,,,,,,,,,,,,
To work client administration systems data,,,,To model approaches techniques machine learning,,,,,,,,,,,,,
To ensure analysis meets business requirements,,,,To learn statistics data visualization storytelling,,,,,,,,,,,,,
To ensure implementation service quality customer,,,,To identify design implement internal process,,,,,,,,,,,,,
To report client development chief staff,,,,To develop maintain machine learning models,,,,,,,,,,,,,
To report research study document data,,,,To learn skills development job description,,,,,,,,,,,,,
To report data management manage full,,,,To learn models model driver behaviour,,,,,,,,,,,,,
To report systems data models support,,,,To base analytics technologies well data,,,,,,,,,,,,,
To create reports create indepth analysis,,,,To model ability work crossfunctional teams,,,,,,,,,,,,,
To report accounting project management operations,,,,To learn answer business problems defines,,,,,,,,,,,,,
To report metrics wrangle data multiple,,,,To train research latest techniques tools,,,,,,,,,,,,,
To develop data management dashboarding solutions,,,,To learn models algorithms process optimization,,,,,,,,,,,,,
To report database environment reports advise,,,,To develop solution time box project,,,,,,,,,,,,,
To develop solutions statistical analysis needs,,,,To program responsibilities team product design,,,,,,,,,,,,,
To understand development methodology experience data,,,,To learn models regression classification tasks,,,,,,,,,,,,,
To support systems data models business,,,,To learn problems address major business,,,,,,,,,,,,,
To identify trends insights support programme,,,,To identify opportunities improvement support business,,,,,,,,,,,,,
To exist processes tools growth team,,,,To develop enhance business needs support,,,,,,,,,,,,,
,,,,To learn engineers main duties responsibilities,,,,,,,,,,,,,
,,,,To learn operations research statistics economics,,,,,,,,,,,,,
,,,,To learn models data analysis thorough,,,,,,,,,,,,,
,,,,To provide data evidence support business,,,,,,,,,,,,,
,,,,To learn job responsibilities development data,,,,,,,,,,,,,
