Data Analyst Entry level,Data Analyst Associate,Data Analyst Senior,Data Scientist Senior,Data Scientist Entry level,Data Engineer Senior,Consultant Senior,Data Engineer Entry level,Big Data Developer Entry level,Data Scientist Associate,Consultant Associate,Data Engineer Associate,Consultant Entry level,Machine Learning Engineer Entry level,Machine Learning Engineer Senior,Big Data Developer Senior,Big Data Developer Associate,Machine Learning Engineer Associate
To use communicate data models analysis,To develop data sources support evaluation,To provide insights impact key business,To model analytics visualization machine learning,To learn production pipelines data exploration,To learn models provide value production,To build analytics applications various technology,To provide support design preparation new,To plan implementation data strategies across,To learn company contribute development data,To base business rules machine learning,To learn models suit project performance,To build data tools dashboards model,To understand computer data science business,To learn products partner teams data,To process solutions design implementation migration,To source process create maintain optimal,To understand data mining techniques experience
To exist data management solutions structural,To report business analysis manager data,To make recommendations product managers game,To grow engineering team help management,To learn models leverage data patterns,To require levels data quality work,To operate model development transformation initiatives,To train data science machine learning,To lead design implementation systems architecture,To test framework test model quality,To learn cases moment experience building,To improve user experience design implement,To distribute systems data extraction ingestion,To challenge problems ability design build,To include investors team data science,To participate development process gathering requirements,To understand experience development best practices,To learn products partner teams data
To report membership business development manager,To work part business operations role,To develop cuttingedge data science analytics,To learn facebook pytorch production systems,To learn software engineering contribute various,To participate product development discussions stakeholders,To work enterprise level organizations projects,To build release new features infrastructure,To identify data technology challenges system,To learn software engineering research new,To develop introduction li create reports,To improve services job description software,To ensure development continuous optimization data,To build data manipulation processing data,To build support responsibility manage endtoend,To realize customer projects areas data,To identify design implement internal process,To learn image processing algorithms work
To improve performance algorithm responsibilities customer,To require work key business stakeholders,To use experience performance reporting query,To learn models data analysis review,To test framework test model quality,To apply data mining methods statistical,To commonlyused concepts practices procedures data,To exist infrastructure new features design,To improve team performance technology stack,To improve lookalike models production systems,To use python sql significant experience,To distribute data process aligning business,To learn data science techniques trend,To process data mining machine learning,To learn techniques deliver actionable insights,To process platform technology consumer cloud,To mentor development support drive delivery,To build apis host models microservice
To develop portfolio data analytics products,To report analysis uncover new opportunities,To report needs position collaborate solutions,To learn techniques advance research codingalgorithmic,To train evaluation work engineering team,To identify design implement internal process,To use dspark apis data products,To need implement maintain source code,To test deployment big data applications,To learn problems ability deliver aiml,To design building data science solutions,To work data scientist team strong,To participate design implementation analytics solutions,To learn models responsibilities machine learning,To make solution production ready work,To build relationships development managers engineers,To drive development functional system specifications,To learn models analysis largescale highdimensional
To identify trends data analysis solve,To report quality management tasks analytics,To identify trends data analysis solve,To need building data product poc,To process production role research implement,To develop maintain scalable data pipelines,To provide data science expertise key,To provide data analytics solution customer,To ensure data quality work closely,To learn models personalization product recommendations,To address data support clients emergence,To create data pipelines analytical solutions,To process data mining predictive modeling,To develop test applications text processing,To learn material support use specific,To understand leadership skills big data,To cod work agile development environment,To learn models part commercial products
To report andor data visualisation systems,To improve business performance use statistical,To provide service management users changes,To develop custom machine learning models,To understand business adoption work project,To use data science artificial intelligence,To use dspark data analysis transforming,To learn models platforms able focus,To improve data engineering process responsibilities,To learn projects project leader full,To put production deep learning cases,To develop architecture data services ecosystem,To model transform raw data way,To learn models analytical models data,To learn models various use cases,To develop software data visualization big,To cod experience scala python java,To take responsibilities team results double
To develop data governance development support,To identify customer needs inter business,To base data analysis collaboration teams,To require lead development clinical data,To learn techniques data mining text,To develop implement data science modelssolutions,To exist products meet customer needs,To maintain support cloud platforms description,To include data acquisition transformation analysis,To develop solutions around machine learning,To learn feature engineering manipulation training,To design architecture job description atleast,,To develop solutions complex business problems,To develop solutions research new ways,To process technology field indepth research,To ensure quality data pipeline assure,To provide analysis research design implementation
To learn analyze business problems solutions,To identify improvement opportunities job description,To include product engineering marketing ongoing,To learn models well optimization simulation,To develop custom machine learning models,To exist solutions job description years,,To understand business client data well,To develop proposals strategies software design,To use methods statistics machine learning,To understand business work python sql,To include loyalty product data design,,To build support pipelines data transformation,To improve business outcomes job responsibilities,To orient projects leadership qualities ability,To stream batch file processing data,
To include use business data glossaries,To make recommendations product team communicate,To report delivery status commercial performance,To improve lead quality client one,To develop test maintain applications software,To learn data mining statistics big,,To process controls systems strategy implement,To model team description du poste,To make inventory data quality requirements,To participate production use cases whose,To build support spark hadoop systems,,To process data visualization tools share,To learn problems ability deliver aiml,To develop software development organization brighters,To run customer engagements support business,
To provide data manipulation support projects,To make use quantitative analysis business,To model design implementation etl processes,To learn mentor junior team members,To learn data mining algorithms enormous,To develop implement maintain data pipelines,,To provide customer use cases feature,To improve software performance contribute integration,To use company product patient knowledge,To exist customer data requirements engineering,To relate data ingestion pipelines work,,To develop results solutions products customers,,,To participate code review sprint demos,
To understand data related business needs,To develop advance project management skills,To report analysis create highquality analytical,To learn create machine learning models,To build core machine learning models,To use data mining machine learning,,To establish support business project stakeholders,,To use machine deep learning algorithms,,To improve data reliability quality efficiency,,To improve engagement job description data,,,,
To report role research council values,To optimize operations rights management systems,To develop dashboards drive implementation selfservice,To use data analytics machine learning,To learn statistics information retrieval recommender,To develop data machine learning pipelines,,To require levels data quality work,,To learn needs analyst teams plans,,To state use cases capture clients,,To learn cnns lstmson projects responsibilities,,,,
To report tasks automated process experience,To use analysis design implement models,To improve business intelligence reporting capabilities,To improve optimize clients performance needs,To need support business job summary,To emerge data scienceanalytics technology trends,,To identify design implement internal process,,To learn solutions various business use,,To develop data architecture best practices,,To learn solutions developer tools ides,,,,
To provide support aspects data analysis,To report dashboard development support product,To provide recommendations &#9; role responsibilities,To learn data engineering design experiments,To learn techniques large amount datasets,To learn pipelines responsible management improvement,,To build data ingestion pipelines multiple,,To learn models decision support frameworks,,To advise management team data science,,To learn techniques within larger projects,,,,
To report needs communicate methodology results,To work project support advise data,To report data managementlevel staff business,To build data products around information,To report presentation insights data role,To learn platform powers big data,,To learn responsibilities gather requirements developers,,To learn models deliver solutions client,,To develop maintain api support teams,,To distribute infrastructure build machine learning,,,,
To report capabilities support product team,To develop monitoring data quality metrics,To report quality management complete handling,To take leadership role building agls,To learn methods optimize analysis methods,To work experience analytical methods technologies,,To ensure performance security business requirements,,To base data analysis insights project,,To develop blueprint design data architecture,,To learn solutions novel rd problems,,,,
To participate design execution analysis product,To report insights data unlock others,To provide support teams software engineering,To learn tasks partner technology information,To learn platform work customers product,To learn models customer data analysis,,To work knowledge handson development experience,,To need project team meetings knowledge,,To exist systems document improve solutions,,To model methodologies data system requirements,,,,
To ongoing data management support data,To learn research integrate data science,To report work learn fundamentals teams,To learn operations research techniques wide,To identify document business process opportunities,,,To build etl process ssis sql,,To understand adoption analytics insights work,,To leverage data analytics solutions various,,,,,,
To provide analysis products feasible business,To ensure data quality consistency bi,To understand google analytics data ability,To build analytics solutions products deliver,To provide statistics business data help,,,To identify design implement process improvements,,To learn techniques data mining processing,,To identify resolve data integration issues,,,,,,
To include analytics insights team members,To report effectiveness data analytics systems,To include data analysis storage reporting,To provide data insights product management,To use data analytics machine learning,,,To understand experience cloud storage infrastructure,,To solve analytics problems communicates results,,To troubleshoot data help planning delivery,,,,,,
To use data science ongoing analytics,To improve optimize clients performance needs,To deliver data management capability support,To make company building right tools,To build algorithms top help clients,,,To build scale reliable data services,,To learn data work closely customers,,To exist solution design system architecture,,,,,,
To report insights data unlock others,To use bi tools key tasks,To report insights mobile games data,To learn models prediction forecasting design,To apply experience marketing advertising technology,,,To build data landscape implementation cloud,,To improve models job description data,,To improve user experience responsibilities development,,,,,,
To report team development launch tds,To report analysis distributes reports stakeholders,To provide roi clients role responsibilities,To use data solve business problems,To identify solution improvement opportunities technology,,,To participate building models scale products,,To model leverage machine learning tools,,To improve user experience job description,,,,,,
To automate reports dashboards data cleaning,To understand relationships data customers business,To report head enterprise data delivery,To develop data products handson responsibilities,To model partner machine learning team,,,To develop implement data science modelssolutions,,To improve literacy value use data,,,,,,,,
To develop reports dashboards analysis tableau,To work head data development team,To understand knowledge experience similar technology,To include business team engineering leads,To structure data sources within company,,,To develop maintain multiple data services,,To learn systems optimize data collection,,,,,,,,
To report dashboards new role allow,To report systems data automation systems,To provide consultation project work data,To learn problems ability deliver aiml,To learn analysis able present results,,,To develop software tools sandbox system,,To use analytics machine learning use,,,,,,,,
To report needs gather user requirements,To provide support guidance data quality,To include analytics insights team members,To apply knowledge various machine learning,To improve solution development process develop,,,To work environment tasks cooperation business,,To learn models development infrastructure model,,,,,,,,
To exist data infrastructure responsibilities duties,To relate data analytics support rollout,To track business value data analytics,To build data products satisfy customers,To learn data visualization statistical models,,,To provide documentation client use operate,,To base projects job description data,,,,,,,,
To require reports various systems role,To work data science product teams,To deliver insights performance responsibilities organisation,To provide data analysis strategy recommendations,To learn data engineering design experiments,,,To build data structures role work,,To require responsibilities leadership role research,,,,,,,,
To participate verification process data quality,To report system li degree business,To report data presentation areas departments,To test implementation production investigate model,To learn models production scale impactfully,,,To establish platform data storage provision,,To develop research collaborations within school,,,,,,,,
To track quality data work team,To learn development across methods tools,To market product data content design,To provide data insights business teams,To automate customer acquisition data insights,,,To learn data mining solutions design,,To improve data collection management procedures,,,,,,,,
To exist processes client insights increase,To provide recommendations insight sales order,To market billing engineering operations teams,To take projects research state production,To exist software applications main responsibilities,,,,,To provide data analysis presenting results,,,,,,,,
To provide reports work stakeholders responsibilities,To report processes sales service position,To develop reports dashboards analysis tableau,To use knowledge design build analytics,To learn techniques largescale datasets verifiably,,,,,To learn models support improvement wide,,,,,,,,
To require maintain accurate customer database,To improve process efficiency role responsibilities,To model reports help product marketing,To solve problems deliver solutions business,To learn econometrics big data technologies,,,,,To learn algorithms able work independently,,,,,,,,
To provide support data analysis functions,To provide data analysis identify trends,To automate reports dashboards insights models,To use data translate analysis results,To provide support expertise product development,,,,,To learn solutions geospatial analysis marketing,,,,,,,,
To need support data audit process,To require input business users systems,To require head data science analytics,To learn models process clean extract,To learn works well team responsibilities,,,,,To use benefit company information responsibilities,,,,,,,,
To develop maintain knowledge data available,To support stakeholders information proactive insights,To report system development modern data,To learn methods functions development modeling,To participate development machine learning models,,,,,To develop enhance business needs support,,,,,,,,
To provide reporting analysis business support,To support adhoc business data needs,To learn models analytics insights report,To learn ability work large amounts,To apply data sets implement machine,,,,,To model data analysis collaborate team,,,,,,,,
To build data products dashboards enable,To understand data research analytics across,To exist processes job responsibilities data,To work freemium software business models,To learn techniques support market expansion,,,,,To learn data mining information retrieval,,,,,,,,
To identify data dependencies support delivery,To report project progress issues risks,To require support business needs support,To create models algorithms modern techniques,To develop machine learningdeep learning models,,,,,To learn models core responsibilities job,,,,,,,,
To provide data trend analysis support,To track monitoring analysis skills tasks,To market technology specialists part data,To learn data mining algorithms resolve,To include engineering product business development,,,,,To need support development grant proposals,,,,,,,,
To ongoing reports analysis andor dashboards,To develop design reports dashboards brand,To learn models customer data analysis,To build monitoring model production along,To learn work closely company expand,,,,,To test frame work test model,,,,,,,,
To require input business users systems,To learn projects conception development models,,To improve product quality performance outcomes,To identify performance status trends time,,,,,To learn algorithms use statistical knowledge,,,,,,,,
To exist tools analyze results reconciles,To report master data activities support,,To use insights key responsibilities design,To develop custom algorithms machine learning,,,,,To collaborate product management understand needs,,,,,,,,
To require reports various systems data,To report data visualization key business,,To develop nonproduction machine learning models,To learn problems ability deliver aiml,,,,,,,,,,,,,
To work collaboration data science team,To ensure business data reporting needs,,To develop customer lifetime value model,To learn models time series image,,,,,,,,,,,,,
To report analysis toolkits support insight,To plan business process improvement business,,To ensure business process landscape optimization,To learn processes creation web applications,,,,,,,,,,,,,
To make recommendations data quality initiatives,To use data visualization tools tableau,,To build analytics tools utilise data,To develop custom data models machine,,,,,,,,,,,,,
To report team compliance program information,To use bi tools senior stakeholders,,To learn engineering relevant technology field,To provide colleagues information value use,,,,,,,,,,,,,
To report job title senior data,To test help business product owners,,To learn techniques regression analysis continuous,To apply data sets present information,,,,,,,,,,,,,
To report support business change activities,To report highlights relevant business trends,,To learn techniques hands experience deep,To learn algorithms propose data analytic,,,,,,,,,,,,,
To ongoing analytics activity creation management,To report analytics experience experience tableau,,To learn ml algorithms platform help,To use production environment participate data,,,,,,,,,,,,,
To exist team consultants job description,To develop data analysis skills within,,To learn techniques best practices data,To develop solutions around machine learning,,,,,,,,,,,,,
To report quality management complete handling,To develop analytics solutions support insight,,To develop knowledge skills application data,To learn job description member inhouse,,,,,,,,,,,,,
To report master data activities support,To analyze data order understand problems,,To identify opportunities improvement work stakeholders,To model statistics machine learning data,,,,,,,,,,,,,
To ongoing operations projects potential responsibilities,To work experience solutions development equivalent,,To learn projects responsible building data,To provide alternatives clients job description,,,,,,,,,,,,,
To understand help optimise clients operations,To plan design development support develop,,To learn solutions antiabuse systems partner,To ensure data quality work closely,,,,,,,,,,,,,
To exist data warehouse job description,To provide management data driven insights,,To learn model collaborate business leaders,To automate data mining algorithms development,,,,,,,,,,,,,
To identify trends insights support policy,To include data engineering product marketing,,To provide data analysis presenting results,To learn techniques role responsibility create,,,,,,,,,,,,,
To report kpis help implement process,To report status progress project team,,To learn models artificial vision applications,To learn techniques role help clients,,,,,,,,,,,,,
To identify data opportunities strategies clients,To report monitoring player data product,,To find opportunities product process optimization,To use research skills previous experience,,,,,,,,,,,,,
To optimize operations key role responsibilities,To report team data consumption different,,To develop tune data products applications,To learn models support detection analysis,,,,,,,,,,,,,
To base data create business value,To base data analysis collaboration teams,,To lead marketing strategy goal drive,To develop test algorithms tools like,,,,,,,,,,,,,
To base data analysis reach stakeholders,To report adhoc requests design data,,To improve product quality production processes,To ensure solutions tailored business needs,,,,,,,,,,,,,
To ongoing reports data collection systems,To use business intelligence tools design,,To get value data job description,To develop analysis models machine learning,,,,,,,,,,,,,
To include customer sales product google,To learn data science initiatives opportunities,,To learn recommendation systems big data,To apply statistics complex business problems,,,,,,,,,,,,,
To exist reports interpret needs design,To report pipelines work data engineering,,To use variety data tools building,To use python data machine learning,,,,,,,,,,,,,
To identify analyze relevant data users,To use data visualization dashboards methods,,To learn applications process geospatial raster,To work maritime research problems implementation,,,,,,,,,,,,,
To use information management solutions adhere,To make recommendations address business problems,,To use analysis understand business requirements,To build team time extract insights,,,,,,,,,,,,,
To report work project team assist,To provide management reports key performance,,To make use data insights design,To learn research feature engineering bring,,,,,,,,,,,,,
To develop maintain data visualization dashboards,To report support marketing financial analysis,,To apply data mining machine learning,To need collaborate solutions architects customer,,,,,,,,,,,,,
To base clients business needs objectives,To improve company decision making business,,To learn optimization simulation techniques pilot,To base insights data jobproject description,,,,,,,,,,,,,
To improve customer experience work handson,To analyze business needs previous experience,,To learn algorithms development deployment machine,To program languages software technology role,,,,,,,,,,,,,
To develop design accurate reports business,To build support measurement performance reporting,,To grow research analytics team central,To develop analytics solutions support insight,,,,,,,,,,,,,
To test use data quality tools,To report business operational kpis help,,To model machine learning models applicable,To develop product requirements documentation production,,,,,,,,,,,,,
To ongoing development reporting analysis toolkits,To identify opportunities improvement act data,,To require analytics projects response business,To create content data analysis trends,,,,,,,,,,,,,
